{
  "$schema": "spl-v0.2-audit-dispositions.schema.json",
  "schema_version": 1,
  "target_revision": "dffde13c84d9a2ef0567e89dd527ec4776f5ca42",
  "target_tree": "70a99f34c187c6f1c46fa06549af78f33ed2e017",
  "audit_report_sha256": "23f91f67d935026d69313b5e9f4552cc328bc44aff7461f445411052cbc8d50c",
  "compatibility_version": "0.2",
  "scanned_objects": 186,
  "finding_kind": "ambiguous_unspaced_scalar_operator",
  "finding_count": 214,
  "finding_tuple_fields": [
    "object_id",
    "source_location"
  ],
  "unresolved_count": 0,
  "unresolved": [

  ],
  "categories": [
    {
      "id": "audit_fixture_intended_arithmetic_control",
      "disposition": "expected_synthetic_control",
      "rationale": "Synthetic saved search intentionally uses unspaced subtraction to prove that the audit reports an operator-shaped transition candidate.",
      "finding_count": 1,
      "object_count": 1,
      "findings": [
        [
          "audit-fixture-002",
          "control-db/saved_searches/audit-fixture-002:1:39"
        ]
      ]
    },
    {
      "id": "audit_fixture_legacy_field_positive_control",
      "disposition": "expected_synthetic_control",
      "rationale": "Synthetic saved search intentionally uses a legacy punctuation-bearing field spelling as the audit positive control; no production object is represented.",
      "finding_count": 1,
      "object_count": 1,
      "findings": [
        [
          "audit-fixture-001",
          "control-db/saved_searches/audit-fixture-001:1:38"
        ]
      ]
    },
    {
      "id": "audit_or_migration_test_control",
      "disposition": "expected_non_production_source",
      "rationale": "Audit command tests, migration examples, and audit scanner fixtures intentionally contain candidate spellings so the read-only migration tooling remains specified and tested.",
      "finding_count": 25,
      "object_count": 3,
      "findings": [
        [
          "repository:cmd/open-splunk-server/spl_compatibility_audit_command_test.go",
          "repository/cmd/open-splunk-server/spl_compatibility_audit_command_test.go:17:44"
        ],
        [
          "repository:docs/spl-compatibility-v0.2-migration.md",
          "repository/docs/spl-compatibility-v0.2-migration.md:23:35"
        ],
        [
          "repository:docs/spl-compatibility-v0.2-migration.md",
          "repository/docs/spl-compatibility-v0.2-migration.md:30:35"
        ],
        [
          "repository:docs/spl-compatibility-v0.2-migration.md",
          "repository/docs/spl-compatibility-v0.2-migration.md:32:36"
        ],
        [
          "repository:docs/spl-compatibility-v0.2-migration.md",
          "repository/docs/spl-compatibility-v0.2-migration.md:32:52"
        ],
        [
          "repository:internal/splcompataudit/audit_test.go",
          "repository/internal/splcompataudit/audit_test.go:100:59"
        ],
        [
          "repository:internal/splcompataudit/audit_test.go",
          "repository/internal/splcompataudit/audit_test.go:135:35"
        ],
        [
          "repository:internal/splcompataudit/audit_test.go",
          "repository/internal/splcompataudit/audit_test.go:195:81"
        ],
        [
          "repository:internal/splcompataudit/audit_test.go",
          "repository/internal/splcompataudit/audit_test.go:227:104"
        ],
        [
          "repository:internal/splcompataudit/audit_test.go",
          "repository/internal/splcompataudit/audit_test.go:228:99"
        ],
        [
          "repository:internal/splcompataudit/audit_test.go",
          "repository/internal/splcompataudit/audit_test.go:229:105"
        ],
        [
          "repository:internal/splcompataudit/audit_test.go",
          "repository/internal/splcompataudit/audit_test.go:231:63"
        ],
        [
          "repository:internal/splcompataudit/audit_test.go",
          "repository/internal/splcompataudit/audit_test.go:28:72"
        ],
        [
          "repository:internal/splcompataudit/audit_test.go",
          "repository/internal/splcompataudit/audit_test.go:294:68"
        ],
        [
          "repository:internal/splcompataudit/audit_test.go",
          "repository/internal/splcompataudit/audit_test.go:29:65"
        ],
        [
          "repository:internal/splcompataudit/audit_test.go",
          "repository/internal/splcompataudit/audit_test.go:30:76"
        ],
        [
          "repository:internal/splcompataudit/audit_test.go",
          "repository/internal/splcompataudit/audit_test.go:31:73"
        ],
        [
          "repository:internal/splcompataudit/audit_test.go",
          "repository/internal/splcompataudit/audit_test.go:32:75"
        ],
        [
          "repository:internal/splcompataudit/audit_test.go",
          "repository/internal/splcompataudit/audit_test.go:33:68"
        ],
        [
          "repository:internal/splcompataudit/audit_test.go",
          "repository/internal/splcompataudit/audit_test.go:34:81"
        ],
        [
          "repository:internal/splcompataudit/audit_test.go",
          "repository/internal/splcompataudit/audit_test.go:39:76"
        ],
        [
          "repository:internal/splcompataudit/audit_test.go",
          "repository/internal/splcompataudit/audit_test.go:40:77"
        ],
        [
          "repository:internal/splcompataudit/audit_test.go",
          "repository/internal/splcompataudit/audit_test.go:72:32"
        ],
        [
          "repository:internal/splcompataudit/audit_test.go",
          "repository/internal/splcompataudit/audit_test.go:73:33"
        ],
        [
          "repository:internal/splcompataudit/audit_test.go",
          "repository/internal/splcompataudit/audit_test.go:88:60"
        ]
      ]
    },
    {
      "id": "host_language_concatenation_artifact",
      "disposition": "expected_non_spl_source",
      "rationale": "The reported operator is Go or TypeScript source-level string concatenation used to assemble a test query, not an operator inside the authored SPL value.",
      "finding_count": 46,
      "object_count": 17,
      "findings": [
        [
          "repository:internal/clickhouse/bin_edge_numeric_integration_test.go",
          "repository/internal/clickhouse/bin_edge_numeric_integration_test.go:1078:68"
        ],
        [
          "repository:internal/clickhouse/bin_edge_numeric_integration_test.go",
          "repository/internal/clickhouse/bin_edge_numeric_integration_test.go:1078:81"
        ],
        [
          "repository:internal/clickhouse/expression_v02_compiler_test.go",
          "repository/internal/clickhouse/expression_v02_compiler_test.go:434:17"
        ],
        [
          "repository:internal/clickhouse/expression_v02_compiler_test.go",
          "repository/internal/clickhouse/expression_v02_compiler_test.go:434:26"
        ],
        [
          "repository:internal/clickhouse/expression_v02_compiler_test.go",
          "repository/internal/clickhouse/expression_v02_compiler_test.go:434:41"
        ],
        [
          "repository:internal/clickhouse/expression_v02_compiler_test.go",
          "repository/internal/clickhouse/expression_v02_compiler_test.go:434:50"
        ],
        [
          "repository:internal/clickhouse/field_suggestions_test.go",
          "repository/internal/clickhouse/field_suggestions_test.go:302:51"
        ],
        [
          "repository:internal/clickhouse/field_suggestions_test.go",
          "repository/internal/clickhouse/field_suggestions_test.go:302:61"
        ],
        [
          "repository:internal/clickhouse/integral_rounding_compiler_test.go",
          "repository/internal/clickhouse/integral_rounding_compiler_test.go:185:36"
        ],
        [
          "repository:internal/clickhouse/integral_rounding_compiler_test.go",
          "repository/internal/clickhouse/integral_rounding_compiler_test.go:185:47"
        ],
        [
          "repository:internal/clickhouse/integral_rounding_compiler_test.go",
          "repository/internal/clickhouse/integral_rounding_compiler_test.go:52:30"
        ],
        [
          "repository:internal/clickhouse/integral_rounding_compiler_test.go",
          "repository/internal/clickhouse/integral_rounding_compiler_test.go:52:39"
        ],
        [
          "repository:internal/clickhouse/like_compiler_test.go",
          "repository/internal/clickhouse/like_compiler_test.go:117:37"
        ],
        [
          "repository:internal/clickhouse/like_compiler_test.go",
          "repository/internal/clickhouse/like_compiler_test.go:117:48"
        ],
        [
          "repository:internal/clickhouse/match_compiler_test.go",
          "repository/internal/clickhouse/match_compiler_test.go:112:37"
        ],
        [
          "repository:internal/clickhouse/match_compiler_test.go",
          "repository/internal/clickhouse/match_compiler_test.go:112:48"
        ],
        [
          "repository:internal/clickhouse/match_compiler_test.go",
          "repository/internal/clickhouse/match_compiler_test.go:279:29"
        ],
        [
          "repository:internal/clickhouse/mvcount_compiler_test.go",
          "repository/internal/clickhouse/mvcount_compiler_test.go:180:34"
        ],
        [
          "repository:internal/clickhouse/mvcount_compiler_test.go",
          "repository/internal/clickhouse/mvcount_compiler_test.go:180:45"
        ],
        [
          "repository:internal/clickhouse/relative_time_compiler_test.go",
          "repository/internal/clickhouse/relative_time_compiler_test.go:614:36"
        ],
        [
          "repository:internal/clickhouse/relative_time_compiler_test.go",
          "repository/internal/clickhouse/relative_time_compiler_test.go:614:47"
        ],
        [
          "repository:internal/clickhouse/relative_time_integration_test.go",
          "repository/internal/clickhouse/relative_time_integration_test.go:200:25"
        ],
        [